section,slot,question,answer_1,points_1,answer_2,points_2,answer_3,points_3,answer_4,points_4,answer_5,points_5,answer_6,points_6,answer_7,points_7
EPISODE,,Office Life,,,,,,,,,,,,,,
ROUND,1,Name something you find on an office desk,Computer,26,Coffee,18,Papers,14,Phone,12,Pen,10,Sticky Notes,8,Photo,5
ROUND,2,Name a reason people call in sick,Cold,30,Flu,20,Headache,15,Stomach Bug,12,Migraine,10,Back Pain,6,,
ROUND,3,Name something said in a boring meeting,Any questions,28,Let's circle back,22,Moving on,18,Take offline,16,Sync later,10,,,,
ROUND,4,Name a snack people hide in their desk,Candy,34,Chips,24,Granola Bar,18,Cookies,14,,,,,,
ROUND,5,Name something you hate hearing on Monday,Meeting,40,Deadline,30,All-hands,18,,,,,,,,
FM,1,Name a job people do in an office,Manager,25,Accountant,20,Receptionist,18,Sales,15,IT,12,,
FM,2,Name something that breaks the copy machine,Paper Jam,42,Toner,20,Too much paper,15,Staples,10,User error,8,,
FM,3,Name a day people hate working,Monday,48,Friday,15,Weekend,12,Holiday Eve,10,Payday Minus One,8,,
FM,4,Name something in a break room,Coffee Maker,35,Fridge,22,Microwave,18,Table,12,Vending Machine,8,,
FM,5,Name an excuse for being late,Traffic,40,Alarm,20,Kids,15,Train,12,Weather,8,,
